{
  "banks": {
    "global": [
      {
        "controls": [
          {
            "description": "Master effects macro",
            "id": "masterFx",
            "label": "FX Macro",
            "target": "fx.master"
          },
          {
            "description": "Global animation speed",
            "id": "speed",
            "label": "Speed",
            "target": "globals.speed"
          },
          {
            "description": "Session tempo",
            "id": "bpm",
            "label": "Tempo",
            "target": "transport.bpm"
          },
          {
            "description": "Toggle HUD visibility",
            "id": "hud",
            "label": "HUD Visible",
            "target": "ui.hud"
          },
          {
            "description": "Camera distance",
            "id": "camDist",
            "label": "Camera Distance",
            "target": "camera.dist"
          }
        ],
        "id": "home",
        "label": "Home"
      }
    ]
  },
  "console": {
    "slots": [
      {
        "active": true,
        "assetId": "media.webcam.primary",
        "index": 1,
        "label": "Webcam (Primary)",
        "opacity": 1.0,
        "parameters": {
          "console.layer1.device": 0.0,
          "console.layer1.deviceInfoOverlay": true,
          "console.layer1.gain": 1.0,
          "console.layer1.mirror": true,
          "console.layer1.resolution": 2.0
        }
      },
      {
        "active": true,
        "assetId": "fx.motion_extract",
        "coverage": {
          "columns": 0,
          "mode": "upstream"
        },
        "index": 2,
        "label": "Motion Extract",
        "opacity": 1.0,
        "parameters": {
          "effects.motion.alphaMix": 1.0,
          "effects.motion.blur": 8.0,
          "effects.motion.boost": 8.0,
          "effects.motion.coverage": 0.0,
          "effects.motion.coverageMask": true,
          "effects.motion.fadeBeats": 16.0,
          "effects.motion.headColorB": 0.0,
          "effects.motion.headColorG": 256.0,
          "effects.motion.headColorR": 0.0,
          "effects.motion.mix": 1.0,
          "effects.motion.softness": 1.0,
          "effects.motion.tailColorB": 256.0,
          "effects.motion.tailColorG": 0.0,
          "effects.motion.tailColorR": 0.0,
          "effects.motion.tailOpacity": 0.0,
          "effects.motion.threshold": 0.8999999761581421
        }
      },
      {
        "active": true,
        "assetId": "fx.ascii_supersample",
        "coverage": {
          "columns": 0,
          "mode": "upstream"
        },
        "index": 3,
        "label": "ASCII Supersample",
        "opacity": 1.0,
        "parameters": {
          "effects.asciiSupersample.block": 24.0,
          "effects.asciiSupersample.characterSet": 2.0,
          "effects.asciiSupersample.colorMode": 2.0,
          "effects.asciiSupersample.coverage": 0.0,
          "effects.asciiSupersample.coverageMask": false,
          "effects.asciiSupersample.debugMode": 0.0,
          "effects.asciiSupersample.font": 0.0,
          "effects.asciiSupersample.gamma": 0.0,
          "effects.asciiSupersample.jitter": 0.10000000149011612
        }
      },
      {
        "active": true,
        "assetId": "generative.oscilloscope",
        "index": 4,
        "label": "Oscilloscope",
        "opacity": 1.0,
        "parameters": {
          "console.layer4.alpha": 1.0,
          "console.layer4.amplitude": 2.0,
          "console.layer4.baseAmount": 0.5,
          "console.layer4.bgColorB": 0.0,
          "console.layer4.bgColorG": 1.0,
          "console.layer4.bgColorR": 0.0,
          "console.layer4.colorB": 0.550000011920929,
          "console.layer4.colorG": 1.0,
          "console.layer4.colorR": 0.0,
          "console.layer4.decay": 1.0,
          "console.layer4.freqX": 0.10000000149011612,
          "console.layer4.freqY": {
            "base": 0.20000000298023224,
            "modifiers": []
          },
          "console.layer4.glowAlpha": {
            "base": 0.10000000149011612,
            "modifiers": []
          },
          "console.layer4.glowFalloff": 2.0,
          "console.layer4.glowRadius": 2.0,
          "console.layer4.gridAlpha": 0.4000000059604645,
          "console.layer4.gridDivisions": 4.0,
          "console.layer4.historySize": 256.0,
          "console.layer4.intensity": 1.0,
          "console.layer4.modAmount": {
            "base": 0.550000011920929,
            "modifiers": []
          },
          "console.layer4.modMode": 1.0,
          "console.layer4.morph": 0.4000000059604645,
          "console.layer4.pattern": 1.0,
          "console.layer4.phaseOffsetDeg": 90.0,
          "console.layer4.pointSize": 5.0,
          "console.layer4.radialAmount": {
            "base": 0.44999998807907104,
            "modifiers": []
          },
          "console.layer4.rotationDeg": 0.0,
          "console.layer4.sampleDensity": 1.0,
          "console.layer4.showCrosshair": true,
          "console.layer4.showGlow": true,
          "console.layer4.showGrid": true,
          "console.layer4.speed": 5.0,
          "console.layer4.speedInput": 0.0,
          "console.layer4.speedModAmount": 1.0,
          "console.layer4.thickness": 10.0,
          "console.layer4.wiggleAmount": {
            "base": 0.2199999988079071,
            "modifiers": []
          },
          "console.layer4.xBias": 0.0,
          "console.layer4.xInput": 0.0,
          "console.layer4.xScale": 1.0,
          "console.layer4.yBias": 0.0,
          "console.layer4.yInput": 0.0,
          "console.layer4.yScale": 1.0
        }
      }
    ]
  },
  "effects": {
    "ascii": {
      "aspect": 0.0,
      "block": 16.0,
      "characterSet": 0.0,
      "colorMode": 1.0,
      "gamma": 1.0,
      "jitter": 0.0,
      "padding": 32.0,
      "route": 0.0
    },
    "asciiSupersample": {
      "block": 24.0,
      "characterSet": 2.0,
      "colorMode": 2.0,
      "gamma": 0.0,
      "jitter": 0.10000000149011612,
      "route": 1.0
    },
    "crt": {
      "bleed": 0.15000000596046448,
      "glow": 2.0,
      "headSwitch": 0.0,
      "lumaNoise": 0.0,
      "perChannelOffset": 0.0,
      "rgbMisalignment": 0.0,
      "route": 0.0,
      "scanline": 0.4000000059604645,
      "scanlineJitter": 0.10000000149011612,
      "softness": {
        "base": 10.0,
        "modifiers": []
      },
      "subpixelAspect": 4.0,
      "subpixelDensity": 9.0,
      "subpixelPadding": 0.0,
      "syncTear": 0.20000000298023224,
      "trackingWobble": 0.10000000149011612,
      "vignette": 0.25
    },
    "dither": {
      "cellSize": 24.0,
      "route": 0.0
    },
    "motion": {
      "alphaMix": 1.0,
      "blur": 8.0,
      "boost": 8.0,
      "fadeBeats": 16.0,
      "headColorB": 0.0,
      "headColorG": 256.0,
      "headColorR": 0.0,
      "mix": 1.0,
      "route": 1.0,
      "softness": 1.0,
      "tailColorB": 256.0,
      "tailColorG": 0.0,
      "tailColorR": 0.0,
      "tailOpacity": 0.0,
      "threshold": 0.8999999761581421
    }
  },
  "globals": {
    "camera.dist": 700.0,
    "fx.master": {
      "base": 0.0,
      "modifiers": []
    },
    "globals.speed": 1.0,
    "overlay.text.color.b": 255.0,
    "overlay.text.color.g": 0.0,
    "overlay.text.color.r": 255.0,
    "overlay.text.content": "hello world",
    "overlay.text.font": "VCR_OSD_MONO_1.001.ttf",
    "overlay.text.size": 144.0,
    "transport.bpm": 120.0
  },
  "mappings": {
    "router": {
      "cc": [],
      "osc": [
        {
          "bank": "home",
          "pattern": "/sensor/host/localmic/mic-level",
          "target": "effects.crt.softness"
        },
        {
          "bank": "home",
          "pattern": "/sensor/host/localmic/mic-level",
          "target": "console.layer4.wiggleAmount"
        },
        {
          "bank": "home",
          "pattern": "/sensor/host/localmic/mic-level",
          "target": "console.layer4.radialAmount"
        },
        {
          "bank": "home",
          "pattern": "/sensor/host/localmic/mic-level",
          "target": "console.layer4.modAmount"
        },
        {
          "bank": "home",
          "pattern": "/sensor/host/localmic/mic-level",
          "target": "console.layer4.freqY"
        },
        {
          "bank": "home",
          "pattern": "/sensor/host/localmic/mic-level",
          "target": "console.layer4.glowAlpha"
        }
      ],
      "oscSources": [
        {
          "blend": "scale",
          "in": [
            0.0,
            0.10000000149011612
          ],
          "out": [
            0.0,
            3.0
          ],
          "pattern": "/sensor/host/localmic/mic-level",
          "relative": true
        },
        {
          "blend": "scale",
          "in": [
            0.0,
            1.0
          ],
          "out": [
            0.0,
            1.0
          ],
          "pattern": "/sensor/host/localmic/mic-peak",
          "relative": true
        }
      ]
    },
    "slotAssignments": {
      "assignments": []
    }
  },
  "scene": {
    "savedAt": "2026-04-23T15:47:40-0400",
    "schemaVersion": 2,
    "source": {
      "name": "ascii-cam-scope",
      "path": "layers/scenes/ascii-cam-scope.json"
    },
    "storage": {
      "kind": "named",
      "name": "ascii-cam-scope",
      "path": "layers/scenes/ascii-cam-scope.json"
    }
  }
}
